"Story","Title","Result","Date","Stability","Duration (s)"
"API Testing","JSON Placeholder /todos should retrieve a todo item by id","SUCCESS","2023-12-11T04:04:41.872Z[Etc/UTC]","0.0","0.51"
"Blended Testing","GitHub Pages should check the state of the system before interacting with the UI","SUCCESS","2023-12-11T04:04:42.393Z[Etc/UTC]","0.0","0.8"
"Multi-actor scenarios","Todo List App supports multiple actors using separate browsers","SUCCESS","2023-12-11T04:04:43.204Z[Etc/UTC]","0.0","0.88"
"Recording items","Todo List App should allow me to add todo items","SUCCESS","2023-12-11T04:04:44.096Z[Etc/UTC]","0.0","0.51"
"Recording items","Todo List App should clear text input field when an item is added","SUCCESS","2023-12-11T04:04:44.61Z[Etc/UTC]","0.0","0.45"
"Recording items","Todo List App should reflect the number of items left in the counter","SUCCESS","2023-12-11T04:04:45.065Z[Etc/UTC]","0.0","0.67"
"Recording items","Todo List App should show #main and #footer sections only when list contains items","SUCCESS","2023-12-11T04:04:45.738Z[Etc/UTC]","0.0","0.99"
