"Story","Title","Result","Date","Stability","Duration (s)"
"API Testing","JSON Placeholder /todos should retrieve a todo item by id","SUCCESS","2023-12-04T22:31:58.124Z[Etc/UTC]","0.0","0.57"
"Recording items","Todo List App should allow me to add todo items","SUCCESS","2023-12-04T22:32:00.958Z[Etc/UTC]","0.0","0.55"
"Recording items","Todo List App should clear text input field when an item is added","SUCCESS","2023-12-04T22:32:01.507Z[Etc/UTC]","0.0","0.47"
"Recording items","Todo List App should reflect the number of items left in the counter","SUCCESS","2023-12-04T22:32:01.984Z[Etc/UTC]","0.0","0.61"
"Recording items","Todo List App should show #main and #footer sections only when list contains items","SUCCESS","2023-12-04T22:32:02.596Z[Etc/UTC]","0.0","0.99"
