"Story","Title","Result","Date","Stability","Duration (s)"
"Multi-actor scenarios","Todo List App supports multiple actors using separate browsers","SUCCESS","2023-06-10T23:24:26.594Z[Etc/UTC]","0.0","1.7"
"Recording items","Todo List App should allow me to add todo items","SUCCESS","2023-06-10T23:24:28.303Z[Etc/UTC]","0.0","0.66"
"Recording items","Todo List App should clear text input field when an item is added","SUCCESS","2023-06-10T23:24:28.97Z[Etc/UTC]","0.0","0.49"
"Recording items","Todo List App should reflect the number of items left in the counter","SUCCESS","2023-06-10T23:24:29.471Z[Etc/UTC]","0.0","0.71"
"Recording items","Todo List App should show #main and #footer sections only when list contains items","SUCCESS","2023-06-10T23:24:30.188Z[Etc/UTC]","0.0","1.04"
