"Story","Title","Result","Date","Stability","Duration (s)"
"API Testing","JSON Placeholder /todos should retrieve a todo item by id","SUCCESS","2023-10-04T22:27:23.882Z[Etc/UTC]","0.0","5.02"
"Blended Testing","GitHub Pages should check the state of the system before interacting with the UI","SUCCESS","2023-10-04T22:27:28.919Z[Etc/UTC]","0.0","2.58"
"Multi-actor scenarios","Todo List App supports multiple actors using separate browsers","SUCCESS","2023-10-04T22:27:31.511Z[Etc/UTC]","0.0","2.02"
"Recording items","Todo List App should allow me to add todo items","SUCCESS","2023-10-04T22:27:33.555Z[Etc/UTC]","0.0","1.15"
"Recording items","Todo List App should clear text input field when an item is added","SUCCESS","2023-10-04T22:27:34.725Z[Etc/UTC]","0.0","0.91"
"Recording items","Todo List App should reflect the number of items left in the counter","SUCCESS","2023-10-04T22:27:35.653Z[Etc/UTC]","0.0","1.18"
"Recording items","Todo List App should show #main and #footer sections only when list contains items","SUCCESS","2023-10-04T22:27:36.844Z[Etc/UTC]","0.0","1.51"
