"Story","Title","Result","Date","Stability","Duration (s)"
"API Testing","JSON Placeholder /todos should retrieve a todo item by id","SUCCESS","2023-11-13T21:26:31.355Z[Etc/UTC]","0.0","0.66"
"Blended Testing","GitHub Pages should check the state of the system before interacting with the UI","SUCCESS","2023-11-13T21:26:32.028Z[Etc/UTC]","0.0","0.9"
"Multi-actor scenarios","Todo List App supports multiple actors using separate browsers","SUCCESS","2023-11-13T21:26:32.931Z[Etc/UTC]","0.0","0.86"
"Recording items","Todo List App should allow me to add todo items","SUCCESS","2023-11-13T21:26:33.801Z[Etc/UTC]","0.0","0.54"
"Recording items","Todo List App should clear text input field when an item is added","SUCCESS","2023-11-13T21:26:34.344Z[Etc/UTC]","0.0","0.44"
"Recording items","Todo List App should reflect the number of items left in the counter","SUCCESS","2023-11-13T21:26:34.788Z[Etc/UTC]","0.0","0.64"
"Recording items","Todo List App should show #main and #footer sections only when list contains items","SUCCESS","2023-11-13T21:26:35.431Z[Etc/UTC]","0.0","0.98"
