"Story","Title","Result","Date","Stability","Duration (s)"
"Recording items","Todo List App should allow me to add todo items","SUCCESS","2023-08-25T21:34:50.375Z[Etc/UTC]","0.0","0.88"
"Recording items","Todo List App should clear text input field when an item is added","SUCCESS","2023-08-25T21:34:51.266Z[Etc/UTC]","0.0","0.7"
"Vanilla Playwright Test","New Todo should allow me to add todo items","SUCCESS","2023-08-25T21:34:54.871Z[Etc/UTC]","0.0","0.86"
"Vanilla Playwright Test","New Todo should clear text input field when an item is added","SUCCESS","2023-08-25T21:34:55.735Z[Etc/UTC]","0.0","0.54"
"Vanilla Playwright Test","New Todo should reflect the number of items left in the counter","SUCCESS","2023-08-25T21:34:56.275Z[Etc/UTC]","0.0","0.62"
"Vanilla Playwright Test","New Todo should show #main and #footer when items added","SUCCESS","2023-08-25T21:34:56.903Z[Etc/UTC]","0.0","0.51"
"Vanilla Playwright Test","New Todo should clear text input field when an item is added","SUCCESS","2023-08-25T21:35:11.768Z[Etc/UTC]","0.0","0.83"
"Vanilla Playwright Test","New Todo should show #main and #footer when items added","SUCCESS","2023-08-25T21:35:13.641Z[Etc/UTC]","0.0","0.84"
