"Story","Title","Result","Date","Stability","Duration (s)"
"Multi-actor scenarios","Todo List App supports multiple actors using separate browsers","SUCCESS","2023-08-25T15:41:40.037Z[Etc/UTC]","0.0","7.22"
"Recording items","Todo List App should allow me to add todo items","SUCCESS","2023-08-25T15:41:47.281Z[Etc/UTC]","0.0","1.55"
"Recording items","Todo List App should clear text input field when an item is added","SUCCESS","2023-08-25T15:41:48.839Z[Etc/UTC]","0.0","1.28"
"Recording items","Todo List App should reflect the number of items left in the counter","SUCCESS","2023-08-25T15:41:50.144Z[Etc/UTC]","0.0","1.72"
"Recording items","Todo List App should show #main and #footer sections only when list contains items","SUCCESS","2023-08-25T15:41:51.888Z[Etc/UTC]","0.0","1.97"
