"Story","Title","Result","Date","Stability","Duration (s)"
"Multi-actor scenarios","Todo List App supports multiple actors using separate browsers","SUCCESS","2023-07-12T00:35:49.515Z[Etc/UTC]","0.0","2.94"
"Recording items","Todo List App should allow me to add todo items","SUCCESS","2023-07-12T00:35:52.464Z[Etc/UTC]","0.0","0.84"
"Recording items","Todo List App should clear text input field when an item is added","SUCCESS","2023-07-12T00:35:53.315Z[Etc/UTC]","0.0","0.69"
"Recording items","Todo List App should reflect the number of items left in the counter","SUCCESS","2023-07-12T00:35:54.016Z[Etc/UTC]","0.0","0.94"
"Recording items","Todo List App should show #main and #footer sections only when list contains items","SUCCESS","2023-07-12T00:35:54.969Z[Etc/UTC]","0.0","1.21"
