"Story","Title","Result","Date","Stability","Duration (s)"
"Multi-actor scenarios","Todo List App supports multiple actors using separate browsers","SUCCESS","2023-07-12T00:29:02.181Z[Etc/UTC]","0.0","3.06"
"Recording items","Todo List App should allow me to add todo items","SUCCESS","2023-07-12T00:29:05.252Z[Etc/UTC]","0.0","0.9"
"Recording items","Todo List App should clear text input field when an item is added","SUCCESS","2023-07-12T00:29:06.162Z[Etc/UTC]","0.0","0.76"
"Recording items","Todo List App should reflect the number of items left in the counter","SUCCESS","2023-07-12T00:29:06.94Z[Etc/UTC]","0.0","0.98"
"Recording items","Todo List App should show #main and #footer sections only when list contains items","SUCCESS","2023-07-12T00:29:07.933Z[Etc/UTC]","0.0","1.26"
