"Story","Title","Result","Date","Stability","Duration (s)"
"Multi-actor scenarios","Todo List App supports multiple actors using separate browsers","SUCCESS","2023-09-11T04:44:58.657Z[Etc/UTC]","0.0","2.97"
"Recording items","Todo List App should allow me to add todo items","SUCCESS","2023-09-11T04:45:01.636Z[Etc/UTC]","0.0","0.85"
"Recording items","Todo List App should clear text input field when an item is added","SUCCESS","2023-09-11T04:45:02.495Z[Etc/UTC]","0.0","0.68"
"Recording items","Todo List App should reflect the number of items left in the counter","SUCCESS","2023-09-11T04:45:03.184Z[Etc/UTC]","0.0","0.95"
"Recording items","Todo List App should show #main and #footer sections only when list contains items","SUCCESS","2023-09-11T04:45:04.14Z[Etc/UTC]","0.0","1.21"
