"Story","Title","Result","Date","Stability","Duration (s)"
"API Testing","JSON Placeholder /todos should retrieve a todo item by id","SUCCESS","2023-10-15T04:43:46.17Z[Etc/UTC]","0.0","2.23"
"Blended Testing","GitHub Pages should check the state of the system before interacting with the UI","SUCCESS","2023-10-15T04:43:48.42Z[Etc/UTC]","0.0","1.71"
"Multi-actor scenarios","Todo List App supports multiple actors using separate browsers","SUCCESS","2023-10-15T04:43:50.138Z[Etc/UTC]","0.0","2.41"
"Recording items","Todo List App should allow me to add todo items","SUCCESS","2023-10-15T04:43:52.557Z[Etc/UTC]","0.0","1.32"
"Recording items","Todo List App should clear text input field when an item is added","SUCCESS","2023-10-15T04:43:53.891Z[Etc/UTC]","0.0","1.12"
"Recording items","Todo List App should reflect the number of items left in the counter","SUCCESS","2023-10-15T04:43:55.02Z[Etc/UTC]","0.0","1.47"
"Recording items","Todo List App should show #main and #footer sections only when list contains items","SUCCESS","2023-10-15T04:43:56.5Z[Etc/UTC]","0.0","1.69"
