"Story","Title","Result","Date","Stability","Duration (s)"
"API Testing","JSON Placeholder /todos should retrieve a todo item by id","SUCCESS","2023-10-21T01:04:22.198Z[Etc/UTC]","0.0","9.35"
"Blended Testing","GitHub Pages should check the state of the system before interacting with the UI","SUCCESS","2023-10-21T01:04:31.567Z[Etc/UTC]","0.0","2.78"
"Multi-actor scenarios","Todo List App supports multiple actors using separate browsers","SUCCESS","2023-10-21T01:04:34.363Z[Etc/UTC]","0.0","2.43"
"Recording items","Todo List App should allow me to add todo items","SUCCESS","2023-10-21T01:04:36.808Z[Etc/UTC]","0.0","1.17"
"Recording items","Todo List App should clear text input field when an item is added","SUCCESS","2023-10-21T01:04:37.989Z[Etc/UTC]","0.0","0.97"
"Recording items","Todo List App should reflect the number of items left in the counter","SUCCESS","2023-10-21T01:04:38.97Z[Etc/UTC]","0.0","1.23"
"Recording items","Todo List App should show #main and #footer sections only when list contains items","SUCCESS","2023-10-21T01:04:40.215Z[Etc/UTC]","0.0","1.5"
