"Story","Title","Result","Date","Stability","Duration (s)"
"API Testing","JSON Placeholder /todos should retrieve a todo item by id","SUCCESS","2023-12-16T03:44:54.545Z[Etc/UTC]","0.0","2.26"
"Blended Testing","GitHub Pages should check the state of the system before interacting with the UI","SUCCESS","2023-12-16T03:44:56.818Z[Etc/UTC]","0.0","2.31"
"Multi-actor scenarios","Todo List App supports multiple actors using separate browsers","SUCCESS","2023-12-16T03:44:59.129Z[Etc/UTC]","0.0","1.55"
"Recording items","Todo List App should allow me to add todo items","SUCCESS","2023-12-16T03:45:00.686Z[Etc/UTC]","0.0","0.87"
"Recording items","Todo List App should clear text input field when an item is added","SUCCESS","2023-12-16T03:45:01.559Z[Etc/UTC]","0.0","0.71"
"Recording items","Todo List App should reflect the number of items left in the counter","SUCCESS","2023-12-16T03:45:02.278Z[Etc/UTC]","0.0","0.98"
"Recording items","Todo List App should show #main and #footer sections only when list contains items","SUCCESS","2023-12-16T03:45:03.268Z[Etc/UTC]","0.0","1.26"
