"Story","Title","Result","Date","Stability","Duration (s)"
"API Testing","JSON Placeholder /todos should retrieve a todo item by id","SUCCESS","2023-10-15T04:43:30.001Z[Etc/UTC]","0.0","1.82"
"Blended Testing","GitHub Pages should check the state of the system before interacting with the UI","SUCCESS","2023-10-15T04:43:31.845Z[Etc/UTC]","0.0","1.29"
"Multi-actor scenarios","Todo List App supports multiple actors using separate browsers","SUCCESS","2023-10-15T04:43:33.146Z[Etc/UTC]","0.0","1.71"
"Recording items","Todo List App should allow me to add todo items","SUCCESS","2023-10-15T04:43:34.86Z[Etc/UTC]","0.0","0.98"
"Recording items","Todo List App should clear text input field when an item is added","SUCCESS","2023-10-15T04:43:35.858Z[Etc/UTC]","0.0","0.8"
"Recording items","Todo List App should reflect the number of items left in the counter","SUCCESS","2023-10-15T04:43:36.669Z[Etc/UTC]","0.0","1.09"
"Recording items","Todo List App should show #main and #footer sections only when list contains items","SUCCESS","2023-10-15T04:43:37.776Z[Etc/UTC]","0.0","1.5"
