"Story","Title","Result","Date","Stability","Duration (s)"
"API Testing","JSON Placeholder /todos should retrieve a todo item by id","SUCCESS","2023-10-30T23:25:08.288Z[Etc/UTC]","0.0","2.08"
"Blended Testing","GitHub Pages should check the state of the system before interacting with the UI","SUCCESS","2023-10-30T23:25:10.389Z[Etc/UTC]","0.0","1.34"
"Multi-actor scenarios","Todo List App supports multiple actors using separate browsers","SUCCESS","2023-10-30T23:25:11.739Z[Etc/UTC]","0.0","1.85"
"Recording items","Todo List App should allow me to add todo items","SUCCESS","2023-10-30T23:25:13.604Z[Etc/UTC]","0.0","1.14"
"Recording items","Todo List App should clear text input field when an item is added","SUCCESS","2023-10-30T23:25:14.762Z[Etc/UTC]","0.0","0.9"
"Recording items","Todo List App should reflect the number of items left in the counter","SUCCESS","2023-10-30T23:25:15.678Z[Etc/UTC]","0.0","1.24"
"Recording items","Todo List App should show #main and #footer sections only when list contains items","SUCCESS","2023-10-30T23:25:16.95Z[Etc/UTC]","0.0","1.55"
