"Story","Title","Result","Date","Stability","Duration (s)"
"Recording items","Todo List App should allow me to add todo items","SUCCESS","2023-07-03T21:59:49.631Z[Etc/UTC]","0.0","0.74"
"Recording items","Todo List App should clear text input field when an item is added","SUCCESS","2023-07-03T21:59:50.373Z[Etc/UTC]","0.0","0.6"
"Recording items","Todo List App should reflect the number of items left in the counter","SUCCESS","2023-07-03T21:59:50.998Z[Etc/UTC]","0.0","0.77"
"Vanilla Playwright Test","New Todo should allow me to add todo items","SUCCESS","2023-07-03T21:59:52.96Z[Etc/UTC]","0.0","0.49"
"Vanilla Playwright Test","New Todo should clear text input field when an item is added","SUCCESS","2023-07-03T21:59:53.459Z[Etc/UTC]","0.0","0.44"
"Vanilla Playwright Test","New Todo should reflect the number of items left in the counter","SUCCESS","2023-07-03T21:59:53.897Z[Etc/UTC]","0.0","0.49"
"Vanilla Playwright Test","New Todo should show #main and #footer when items added","SUCCESS","2023-07-03T21:59:54.387Z[Etc/UTC]","0.0","0.45"
"Recording items","Todo List App should clear text input field when an item is added","SUCCESS","2023-07-03T22:00:00.085Z[Etc/UTC]","0.0","0.89"
"Vanilla Playwright Test","New Todo should allow me to add todo items","SUCCESS","2023-07-03T22:00:03.473Z[Etc/UTC]","0.0","0.71"
"Vanilla Playwright Test","New Todo should clear text input field when an item is added","SUCCESS","2023-07-03T22:00:04.19Z[Etc/UTC]","0.0","0.69"
"Vanilla Playwright Test","New Todo should show #main and #footer when items added","SUCCESS","2023-07-03T22:00:05.921Z[Etc/UTC]","0.0","0.74"
