"Story","Title","Result","Date","Stability","Duration (s)"
"Multi-actor scenarios","Todo List App supports multiple actors using separate browsers","SUCCESS","2023-09-26T04:17:54.769Z[Etc/UTC]","0.0","1.9"
"Recording items","Todo List App should allow me to add todo items","SUCCESS","2023-09-26T04:17:56.678Z[Etc/UTC]","0.0","0.76"
"Recording items","Todo List App should clear text input field when an item is added","SUCCESS","2023-09-26T04:17:57.447Z[Etc/UTC]","0.0","0.56"
"Recording items","Todo List App should reflect the number of items left in the counter","SUCCESS","2023-09-26T04:17:58.024Z[Etc/UTC]","0.0","0.75"
"Recording items","Todo List App should show #main and #footer sections only when list contains items","SUCCESS","2023-09-26T04:17:58.787Z[Etc/UTC]","0.0","1.12"
