"Story","Title","Result","Date","Stability","Duration (s)"
"Multi-actor scenarios","Todo List App supports multiple actors using separate browsers","SUCCESS","2023-09-27T09:43:08.026Z[Etc/UTC]","0.0","3.28"
"Recording items","Todo List App should allow me to add todo items","SUCCESS","2023-09-27T09:43:11.324Z[Etc/UTC]","0.0","0.8"
"Recording items","Todo List App should clear text input field when an item is added","SUCCESS","2023-09-27T09:43:12.133Z[Etc/UTC]","0.0","0.62"
"Recording items","Todo List App should reflect the number of items left in the counter","SUCCESS","2023-09-27T09:43:12.777Z[Etc/UTC]","0.0","0.92"
"Recording items","Todo List App should show #main and #footer sections only when list contains items","SUCCESS","2023-09-27T09:43:13.707Z[Etc/UTC]","0.0","1.3"
