"Story","Title","Result","Date","Stability","Duration (s)"
"Multi-actor scenarios","Todo List App supports multiple actors using separate browsers","SUCCESS","2023-07-12T00:16:48.806Z[Etc/UTC]","0.0","2.15"
"Recording items","Todo List App should allow me to add todo items","SUCCESS","2023-07-12T00:16:50.972Z[Etc/UTC]","0.0","0.91"
"Recording items","Todo List App should clear text input field when an item is added","SUCCESS","2023-07-12T00:16:51.892Z[Etc/UTC]","0.0","0.73"
"Recording items","Todo List App should reflect the number of items left in the counter","SUCCESS","2023-07-12T00:16:52.645Z[Etc/UTC]","0.0","0.98"
"Recording items","Todo List App should show #main and #footer sections only when list contains items","SUCCESS","2023-07-12T00:16:53.631Z[Etc/UTC]","0.0","1.24"
