"Story","Title","Result","Date","Stability","Duration (s)"
"Recording items","Todo List App should allow me to add todo items","SUCCESS","2023-08-14T22:18:38.238Z[Etc/UTC]","0.0","0.76"
"Recording items","Todo List App should clear text input field when an item is added","SUCCESS","2023-08-14T22:18:38.999Z[Etc/UTC]","0.0","0.59"
"Recording items","Todo List App should reflect the number of items left in the counter","SUCCESS","2023-08-14T22:18:39.591Z[Etc/UTC]","0.0","0.82"
"Vanilla Playwright Test","New Todo should allow me to add todo items","SUCCESS","2023-08-14T22:18:42.138Z[Etc/UTC]","0.0","0.76"
"Vanilla Playwright Test","New Todo should clear text input field when an item is added","SUCCESS","2023-08-14T22:18:42.903Z[Etc/UTC]","0.0","0.45"
"Vanilla Playwright Test","New Todo should reflect the number of items left in the counter","SUCCESS","2023-08-14T22:18:43.354Z[Etc/UTC]","0.0","0.53"
"Vanilla Playwright Test","New Todo should show #main and #footer when items added","SUCCESS","2023-08-14T22:18:43.893Z[Etc/UTC]","0.0","0.43"
"Recording items","Todo List App should clear text input field when an item is added","SUCCESS","2023-08-14T22:18:50.014Z[Etc/UTC]","0.0","0.9"
"Vanilla Playwright Test","New Todo should clear text input field when an item is added","SUCCESS","2023-08-14T22:18:57.543Z[Etc/UTC]","0.0","0.72"
"Vanilla Playwright Test","New Todo should reflect the number of items left in the counter","SUCCESS","2023-08-14T22:18:58.263Z[Etc/UTC]","0.0","0.89"
"Vanilla Playwright Test","New Todo should show #main and #footer when items added","SUCCESS","2023-08-14T22:18:59.161Z[Etc/UTC]","0.0","0.72"
