"Story","Title","Result","Date","Stability","Duration (s)"
"Multi-actor scenarios","Todo List App supports multiple actors using separate browsers","SUCCESS","2023-06-17T02:10:04.866Z[Etc/UTC]","0.0","7.75"
"Recording items","Todo List App should allow me to add todo items","SUCCESS","2023-06-17T02:10:12.624Z[Etc/UTC]","0.0","1.11"
"Recording items","Todo List App should clear text input field when an item is added","SUCCESS","2023-06-17T02:10:13.743Z[Etc/UTC]","0.0","1.03"
"Recording items","Todo List App should reflect the number of items left in the counter","SUCCESS","2023-06-17T02:10:14.775Z[Etc/UTC]","0.0","1.14"
"Recording items","Todo List App should show #main and #footer sections only when list contains items","SUCCESS","2023-06-17T02:10:15.922Z[Etc/UTC]","0.0","1.4"
