"Story","Title","Result","Date","Stability","Duration (s)"
"Vanilla Playwright Test","New Todo should allow me to add todo items","SUCCESS","2023-08-25T15:31:47.804Z[Etc/UTC]","0.0","1.05"
"Vanilla Playwright Test","New Todo should allow me to add todo items","SUCCESS","2023-08-25T15:32:01.994Z[Etc/UTC]","0.0","2.91"
"Vanilla Playwright Test","New Todo should allow me to add todo items","SUCCESS","2023-08-25T15:32:27.362Z[Etc/UTC]","0.0","2.04"
"Vanilla Playwright Test","New Todo should clear text input field when an item is added","SUCCESS","2023-08-25T15:32:29.41Z[Etc/UTC]","0.0","1.3"
"Vanilla Playwright Test","New Todo should reflect the number of items left in the counter","SUCCESS","2023-08-25T15:32:30.709Z[Etc/UTC]","0.0","1.32"
"Vanilla Playwright Test","New Todo should show #main and #footer when items added","SUCCESS","2023-08-25T15:32:32.027Z[Etc/UTC]","0.0","1.24"
