"Story","Title","Result","Date","Stability","Duration (s)"
"Vanilla Playwright Test","New Todo should allow me to add todo items","SUCCESS","2023-07-24T23:09:42.75Z[Etc/UTC]","0.0","2.5"
"Vanilla Playwright Test","New Todo should allow me to add todo items","SUCCESS","2023-07-24T23:10:02.737Z[Etc/UTC]","0.0","1.64"
"Vanilla Playwright Test","New Todo should clear text input field when an item is added","SUCCESS","2023-07-24T23:10:04.387Z[Etc/UTC]","0.0","1.0"
"Vanilla Playwright Test","New Todo should reflect the number of items left in the counter","SUCCESS","2023-07-24T23:10:05.392Z[Etc/UTC]","0.0","1.07"
"Vanilla Playwright Test","New Todo should show #main and #footer when items added","SUCCESS","2023-07-24T23:10:06.471Z[Etc/UTC]","0.0","1.05"
