"Story","Title","Result","Date","Stability","Duration (s)"
"API Testing","JSON Placeholder /todos should retrieve a todo item by id","SUCCESS","2023-11-23T23:20:17.969Z[Etc/UTC]","0.0","1.75"
"Blended Testing","GitHub Pages should check the state of the system before interacting with the UI","SUCCESS","2023-11-23T23:20:19.735Z[Etc/UTC]","0.0","1.43"
"Multi-actor scenarios","Todo List App supports multiple actors using separate browsers","SUCCESS","2023-11-23T23:20:21.175Z[Etc/UTC]","0.0","1.54"
"Recording items","Todo List App should reflect the number of items left in the counter","SUCCESS","2023-11-23T23:20:24.365Z[Etc/UTC]","0.0","1.01"
"Recording items","Todo List App should show #main and #footer sections only when list contains items","SUCCESS","2023-11-23T23:20:25.38Z[Etc/UTC]","0.0","1.26"
