"Story","Title","Result","Date","Stability","Duration (s)"
"API Testing","JSON Placeholder /todos should retrieve a todo item by id","SUCCESS","2023-10-23T21:12:52.346Z[Etc/UTC]","0.0","4.51"
"Blended Testing","GitHub Pages should check the state of the system before interacting with the UI","SUCCESS","2023-10-23T21:12:56.883Z[Etc/UTC]","0.0","3.39"
"Multi-actor scenarios","Todo List App supports multiple actors using separate browsers","SUCCESS","2023-10-23T21:13:00.291Z[Etc/UTC]","0.0","3.17"
"Recording items","Todo List App should allow me to add todo items","SUCCESS","2023-10-23T21:13:03.48Z[Etc/UTC]","0.0","1.85"
"Recording items","Todo List App should clear text input field when an item is added","SUCCESS","2023-10-23T21:13:05.335Z[Etc/UTC]","0.0","1.43"
"Recording items","Todo List App should reflect the number of items left in the counter","SUCCESS","2023-10-23T21:13:06.784Z[Etc/UTC]","0.0","1.87"
"Recording items","Todo List App should show #main and #footer sections only when list contains items","SUCCESS","2023-10-23T21:13:08.658Z[Etc/UTC]","0.0","1.99"
