"Story","Title","Result","Date","Stability","Duration (s)"
"Multi-actor scenarios","Todo List App supports multiple actors using separate browsers","SUCCESS","2023-09-22T01:55:35.851Z[Etc/UTC]","0.0","1.78"
"Recording items","Todo List App should allow me to add todo items","SUCCESS","2023-09-22T01:55:37.64Z[Etc/UTC]","0.0","0.69"
"Recording items","Todo List App should clear text input field when an item is added","SUCCESS","2023-09-22T01:55:38.334Z[Etc/UTC]","0.0","0.52"
"Recording items","Todo List App should reflect the number of items left in the counter","SUCCESS","2023-09-22T01:55:38.855Z[Etc/UTC]","0.0","0.71"
"Recording items","Todo List App should show #main and #footer sections only when list contains items","SUCCESS","2023-09-22T01:55:39.572Z[Etc/UTC]","0.0","1.07"
