"Story","Title","Result","Date","Stability","Duration (s)"
"API Testing","JSON Placeholder /todos should retrieve a todo item by id","SUCCESS","2023-11-23T23:17:01.636Z[Etc/UTC]","0.0","1.43"
"Blended Testing","GitHub Pages should check the state of the system before interacting with the UI","SUCCESS","2023-11-23T23:17:03.076Z[Etc/UTC]","0.0","0.83"
"Multi-actor scenarios","Todo List App supports multiple actors using separate browsers","SUCCESS","2023-11-23T23:17:03.915Z[Etc/UTC]","0.0","1.12"
"Recording items","Todo List App should allow me to add todo items","SUCCESS","2023-11-23T23:17:05.039Z[Etc/UTC]","0.0","0.72"
"Recording items","Todo List App should clear text input field when an item is added","SUCCESS","2023-11-23T23:17:05.765Z[Etc/UTC]","0.0","0.56"
"Recording items","Todo List App should reflect the number of items left in the counter","SUCCESS","2023-11-23T23:17:06.327Z[Etc/UTC]","0.0","0.81"
"Recording items","Todo List App should show #main and #footer sections only when list contains items","SUCCESS","2023-11-23T23:17:07.14Z[Etc/UTC]","0.0","1.09"
