"Story","Title","Result","Date","Stability","Duration (s)"
"API Testing","JSON Placeholder /todos should retrieve a todo item by id","SUCCESS","2024-01-09T05:16:08.962Z[Etc/UTC]","0.0","1.29"
"Blended Testing","GitHub Pages should check the state of the system before interacting with the UI","SUCCESS","2024-01-09T05:16:10.269Z[Etc/UTC]","0.0","0.95"
"Multi-actor scenarios","Todo List App supports multiple actors using separate browsers","SUCCESS","2024-01-09T05:16:11.226Z[Etc/UTC]","0.0","1.13"
"Recording items","Todo List App should allow me to add todo items","SUCCESS","2024-01-09T05:16:12.363Z[Etc/UTC]","0.0","0.69"
"Recording items","Todo List App should clear text input field when an item is added","SUCCESS","2024-01-09T05:16:13.057Z[Etc/UTC]","0.0","0.56"
"Recording items","Todo List App should reflect the number of items left in the counter","SUCCESS","2024-01-09T05:16:13.623Z[Etc/UTC]","0.0","0.79"
"Recording items","Todo List App should show #main and #footer sections only when list contains items","SUCCESS","2024-01-09T05:16:14.416Z[Etc/UTC]","0.0","1.08"
