"Story","Title","Result","Date","Stability","Duration (s)"
"Recording items","Todo List App should show #main and #footer sections only when list contains items","SUCCESS","2023-06-06T00:00:55.946Z[Etc/UTC]","0.0","1.04"
"Recording items","Todo List App should show #main and #footer sections only when list contains items","SUCCESS","2023-06-06T00:01:04.474Z[Etc/UTC]","0.0","1.2"
"Recording items","Todo List App should allow me to add todo items","SUCCESS","2023-06-06T00:01:12.481Z[Etc/UTC]","0.0","1.02"
"Recording items","Todo List App should reflect the number of items left in the counter","SUCCESS","2023-06-06T00:01:14.397Z[Etc/UTC]","0.0","1.1"
"Recording items","Todo List App should show #main and #footer sections only when list contains items","SUCCESS","2023-06-06T00:01:15.506Z[Etc/UTC]","0.0","1.45"
