"Story","Title","Result","Date","Stability","Duration (s)"
"Recording items","Todo List App should show #main and #footer sections only when list contains items","SUCCESS","2023-09-01T16:12:35.705Z[Etc/UTC]","0.0","1.06"
"Recording items","Todo List App should show #main and #footer sections only when list contains items","SUCCESS","2023-09-01T16:12:45.145Z[Etc/UTC]","0.0","1.23"
"Recording items","Todo List App should allow me to add todo items","SUCCESS","2023-09-01T16:12:56.175Z[Etc/UTC]","0.0","1.18"
"Recording items","Todo List App should clear text input field when an item is added","SUCCESS","2023-09-01T16:12:57.369Z[Etc/UTC]","0.0","1.08"
"Recording items","Todo List App should reflect the number of items left in the counter","SUCCESS","2023-09-01T16:12:58.46Z[Etc/UTC]","0.0","1.24"
"Recording items","Todo List App should show #main and #footer sections only when list contains items","SUCCESS","2023-09-01T16:12:59.711Z[Etc/UTC]","0.0","1.43"
