"Story","Title","Result","Date","Stability","Duration (s)"
"Recording items","Todo List App should show #main and #footer sections only when list contains items","SUCCESS","2023-07-01T19:40:29.023Z[Etc/UTC]","0.0","1.01"
"Recording items","Todo List App should show #main and #footer sections only when list contains items","SUCCESS","2023-07-01T19:40:38.043Z[Etc/UTC]","0.0","1.27"
"Recording items","Todo List App should allow me to add todo items","SUCCESS","2023-07-01T19:40:48.006Z[Etc/UTC]","0.0","1.1"
"Recording items","Todo List App should reflect the number of items left in the counter","SUCCESS","2023-07-01T19:40:50.03Z[Etc/UTC]","0.0","1.18"
"Recording items","Todo List App should show #main and #footer sections only when list contains items","SUCCESS","2023-07-01T19:40:51.215Z[Etc/UTC]","0.0","1.42"
