"Story","Title","Result","Date","Stability","Duration (s)"
"API Testing","JSON Placeholder /todos should retrieve a todo item by id","SUCCESS","2023-11-22T15:54:28.228Z[Etc/UTC]","0.0","1.54"
"Blended Testing","GitHub Pages should check the state of the system before interacting with the UI","SUCCESS","2023-11-22T15:54:29.785Z[Etc/UTC]","0.0","0.8"
"Multi-actor scenarios","Todo List App supports multiple actors using separate browsers","SUCCESS","2023-11-22T15:54:30.595Z[Etc/UTC]","0.0","1.12"
"Recording items","Todo List App should allow me to add todo items","SUCCESS","2023-11-22T15:54:31.724Z[Etc/UTC]","0.0","0.69"
"Recording items","Todo List App should clear text input field when an item is added","SUCCESS","2023-11-22T15:54:32.42Z[Etc/UTC]","0.0","0.57"
"Recording items","Todo List App should reflect the number of items left in the counter","SUCCESS","2023-11-22T15:54:32.999Z[Etc/UTC]","0.0","0.76"
"Recording items","Todo List App should show #main and #footer sections only when list contains items","SUCCESS","2023-11-22T15:54:33.768Z[Etc/UTC]","0.0","1.1"
