"Story","Title","Result","Date","Stability","Duration (s)"
"API Testing","JSON Placeholder /todos should retrieve a todo item by id","SUCCESS","2023-11-29T13:15:24.873Z[Etc/UTC]","0.0","1.48"
"Blended Testing","GitHub Pages should check the state of the system before interacting with the UI","SUCCESS","2023-11-29T13:15:26.368Z[Etc/UTC]","0.0","0.76"
"Multi-actor scenarios","Todo List App supports multiple actors using separate browsers","SUCCESS","2023-11-29T13:15:27.137Z[Etc/UTC]","0.0","1.16"
"Recording items","Todo List App should allow me to add todo items","SUCCESS","2023-11-29T13:15:28.301Z[Etc/UTC]","0.0","0.7"
"Recording items","Todo List App should clear text input field when an item is added","SUCCESS","2023-11-29T13:15:29.002Z[Etc/UTC]","0.0","0.59"
"Recording items","Todo List App should reflect the number of items left in the counter","SUCCESS","2023-11-29T13:15:29.599Z[Etc/UTC]","0.0","0.8"
"Recording items","Todo List App should show #main and #footer sections only when list contains items","SUCCESS","2023-11-29T13:15:30.406Z[Etc/UTC]","0.0","1.09"
