"Story","Title","Result","Date","Stability","Duration (s)"
"API Testing","JSON Placeholder /todos should retrieve a todo item by id","SUCCESS","2023-12-21T11:11:51.852Z[Etc/UTC]","0.0","1.31"
"Blended Testing","GitHub Pages should check the state of the system before interacting with the UI","SUCCESS","2023-12-21T11:11:53.175Z[Etc/UTC]","0.0","0.85"
"Multi-actor scenarios","Todo List App supports multiple actors using separate browsers","SUCCESS","2023-12-21T11:11:54.03Z[Etc/UTC]","0.0","1.12"
"Recording items","Todo List App should allow me to add todo items","SUCCESS","2023-12-21T11:11:55.152Z[Etc/UTC]","0.0","0.68"
"Recording items","Todo List App should clear text input field when an item is added","SUCCESS","2023-12-21T11:11:55.838Z[Etc/UTC]","0.0","0.55"
"Recording items","Todo List App should reflect the number of items left in the counter","SUCCESS","2023-12-21T11:11:56.394Z[Etc/UTC]","0.0","0.77"
"Recording items","Todo List App should show #main and #footer sections only when list contains items","SUCCESS","2023-12-21T11:11:57.165Z[Etc/UTC]","0.0","1.12"
