"Story","Title","Result","Date","Stability","Duration (s)"
"API Testing","JSON Placeholder /todos should retrieve a todo item by id","SUCCESS","2023-12-16T22:55:39.519Z[Etc/UTC]","0.0","1.71"
"Multi-actor scenarios","Todo List App supports multiple actors using separate browsers","SUCCESS","2023-12-16T22:55:42.206Z[Etc/UTC]","0.0","1.31"
"Recording items","Todo List App should show #main and #footer sections only when list contains items","SUCCESS","2023-12-16T22:55:45.784Z[Etc/UTC]","0.0","1.14"
"API Testing","JSON Placeholder /todos should retrieve a todo item by id","SUCCESS","2023-12-16T22:55:52.625Z[Etc/UTC]","0.0","3.54"
"Blended Testing","GitHub Pages should check the state of the system before interacting with the UI","SUCCESS","2023-12-16T22:55:56.178Z[Etc/UTC]","0.0","1.78"
"Multi-actor scenarios","Todo List App supports multiple actors using separate browsers","SUCCESS","2023-12-16T22:55:57.958Z[Etc/UTC]","0.0","1.62"
"Recording items","Todo List App should reflect the number of items left in the counter","SUCCESS","2023-12-16T22:56:01.276Z[Etc/UTC]","0.0","1.01"
"Recording items","Todo List App should show #main and #footer sections only when list contains items","SUCCESS","2023-12-16T22:56:02.294Z[Etc/UTC]","0.0","1.27"
