"Story","Title","Result","Date","Stability","Duration (s)"
"Multi-actor scenarios","Todo List App supports multiple actors using separate browsers","SUCCESS","2023-06-02T10:33:39.448Z[Etc/UTC]","0.0","3.01"
"Recording items","Todo List App should allow me to add todo items","SUCCESS","2023-06-02T10:33:42.461Z[Etc/UTC]","0.0","0.88"
"Recording items","Todo List App should clear text input field when an item is added","SUCCESS","2023-06-02T10:33:43.355Z[Etc/UTC]","0.0","0.76"
"Recording items","Todo List App should reflect the number of items left in the counter","SUCCESS","2023-06-02T10:33:44.118Z[Etc/UTC]","0.0","0.97"
"Recording items","Todo List App should show #main and #footer sections only when list contains items","SUCCESS","2023-06-02T10:33:45.089Z[Etc/UTC]","0.0","1.25"
