"Story","Title","Result","Date","Stability","Duration (s)"
"Multi-actor scenarios","Todo List App supports multiple actors using separate browsers","SUCCESS","2023-06-24T04:03:58.319Z[Etc/UTC]","0.0","3.14"
"Recording items","Todo List App should allow me to add todo items","SUCCESS","2023-06-24T04:04:01.465Z[Etc/UTC]","0.0","0.96"
"Recording items","Todo List App should clear text input field when an item is added","SUCCESS","2023-06-24T04:04:02.429Z[Etc/UTC]","0.0","0.78"
"Recording items","Todo List App should reflect the number of items left in the counter","SUCCESS","2023-06-24T04:04:03.211Z[Etc/UTC]","0.0","1.01"
"Recording items","Todo List App should show #main and #footer sections only when list contains items","SUCCESS","2023-06-24T04:04:04.228Z[Etc/UTC]","0.0","1.29"
