"Story","Title","Result","Date","Stability","Duration (s)"
"API Testing","JSON Placeholder /todos should retrieve a todo item by id","SUCCESS","2023-11-04T04:53:02.126Z[Etc/UTC]","0.0","2.15"
"Blended Testing","GitHub Pages should check the state of the system before interacting with the UI","SUCCESS","2023-11-04T04:53:04.299Z[Etc/UTC]","0.0","1.28"
"Multi-actor scenarios","Todo List App supports multiple actors using separate browsers","SUCCESS","2023-11-04T04:53:05.588Z[Etc/UTC]","0.0","1.72"
"Recording items","Todo List App should reflect the number of items left in the counter","SUCCESS","2023-11-04T04:53:09.163Z[Etc/UTC]","0.0","1.15"
"Recording items","Todo List App should show #main and #footer sections only when list contains items","SUCCESS","2023-11-04T04:53:10.329Z[Etc/UTC]","0.0","1.46"
