"Story","Title","Result","Date","Stability","Duration (s)"
"Multi-actor scenarios","Todo List App supports multiple actors using separate browsers","SUCCESS","2023-09-22T21:38:09.778Z[Etc/UTC]","0.0","3.07"
"Recording items","Todo List App should allow me to add todo items","SUCCESS","2023-09-22T21:38:12.858Z[Etc/UTC]","0.0","0.86"
"Recording items","Todo List App should clear text input field when an item is added","SUCCESS","2023-09-22T21:38:13.738Z[Etc/UTC]","0.0","0.77"
"Recording items","Todo List App should reflect the number of items left in the counter","SUCCESS","2023-09-22T21:38:14.515Z[Etc/UTC]","0.0","0.98"
"Recording items","Todo List App should show #main and #footer sections only when list contains items","SUCCESS","2023-09-22T21:38:15.503Z[Etc/UTC]","0.0","1.26"
