"Story","Title","Result","Date","Stability","Duration (s)"
"Multi-actor scenarios","Todo List App supports multiple actors using separate browsers","SUCCESS","2023-08-05T04:41:03.791Z[Etc/UTC]","0.0","1.44"
"Recording items","Todo List App should allow me to add todo items","SUCCESS","2023-08-05T04:41:05.237Z[Etc/UTC]","0.0","0.61"
"Recording items","Todo List App should clear text input field when an item is added","SUCCESS","2023-08-05T04:41:05.858Z[Etc/UTC]","0.0","0.47"
"Recording items","Todo List App should reflect the number of items left in the counter","SUCCESS","2023-08-05T04:41:06.342Z[Etc/UTC]","0.0","0.7"
"Recording items","Todo List App should show #main and #footer sections only when list contains items","SUCCESS","2023-08-05T04:41:07.048Z[Etc/UTC]","0.0","1.07"
