"Story","Title","Result","Date","Stability","Duration (s)"
"Multi-actor scenarios","Todo List App supports multiple actors using separate browsers","SUCCESS","2023-07-17T23:20:00.324Z[Etc/UTC]","0.0","1.63"
"Recording items","Todo List App should allow me to add todo items","SUCCESS","2023-07-17T23:20:01.965Z[Etc/UTC]","0.0","0.7"
"Recording items","Todo List App should clear text input field when an item is added","SUCCESS","2023-07-17T23:20:02.67Z[Etc/UTC]","0.0","0.55"
"Recording items","Todo List App should reflect the number of items left in the counter","SUCCESS","2023-07-17T23:20:03.24Z[Etc/UTC]","0.0","0.79"
"Recording items","Todo List App should show #main and #footer sections only when list contains items","SUCCESS","2023-07-17T23:20:04.034Z[Etc/UTC]","0.0","1.13"
