"Story","Title","Result","Date","Stability","Duration (s)"
"API Testing","JSON Placeholder /todos should retrieve a todo item by id","SUCCESS","2023-10-16T21:39:52.2Z[Etc/UTC]","0.0","0.72"
"Blended Testing","GitHub Pages should check the state of the system before interacting with the UI","SUCCESS","2023-10-16T21:39:52.952Z[Etc/UTC]","0.0","1.11"
"Multi-actor scenarios","Todo List App supports multiple actors using separate browsers","SUCCESS","2023-10-16T21:39:54.066Z[Etc/UTC]","0.0","1.12"
"Recording items","Todo List App should allow me to add todo items","SUCCESS","2023-10-16T21:39:55.187Z[Etc/UTC]","0.0","0.63"
"Recording items","Todo List App should clear text input field when an item is added","SUCCESS","2023-10-16T21:39:55.827Z[Etc/UTC]","0.0","0.53"
"Recording items","Todo List App should reflect the number of items left in the counter","SUCCESS","2023-10-16T21:39:56.359Z[Etc/UTC]","0.0","0.75"
"Recording items","Todo List App should show #main and #footer sections only when list contains items","SUCCESS","2023-10-16T21:39:57.121Z[Etc/UTC]","0.0","1.07"
