"Story","Title","Result","Date","Stability","Duration (s)"
"API Testing","JSON Placeholder /todos should retrieve a todo item by id","SUCCESS","2023-10-15T04:43:19.986Z[Etc/UTC]","0.0","0.72"
"Blended Testing","GitHub Pages should check the state of the system before interacting with the UI","SUCCESS","2023-10-15T04:43:20.727Z[Etc/UTC]","0.0","1.14"
"Multi-actor scenarios","Todo List App supports multiple actors using separate browsers","SUCCESS","2023-10-15T04:43:21.878Z[Etc/UTC]","0.0","1.08"
"Recording items","Todo List App should allow me to add todo items","SUCCESS","2023-10-15T04:43:22.975Z[Etc/UTC]","0.0","0.71"
"Recording items","Todo List App should clear text input field when an item is added","SUCCESS","2023-10-15T04:43:23.698Z[Etc/UTC]","0.0","0.6"
"Recording items","Todo List App should reflect the number of items left in the counter","SUCCESS","2023-10-15T04:43:24.303Z[Etc/UTC]","0.0","0.83"
"Recording items","Todo List App should show #main and #footer sections only when list contains items","SUCCESS","2023-10-15T04:43:25.142Z[Etc/UTC]","0.0","1.23"
