"Story","Title","Result","Date","Stability","Duration (s)"
"Multi-actor scenarios","Todo List App supports multiple actors using separate browsers","SUCCESS","2023-08-08T22:11:26.646Z[Etc/UTC]","0.0","3.95"
"Recording items","Todo List App should allow me to add todo items","SUCCESS","2023-08-08T22:11:30.619Z[Etc/UTC]","0.0","1.17"
"Recording items","Todo List App should clear text input field when an item is added","SUCCESS","2023-08-08T22:11:31.802Z[Etc/UTC]","0.0","0.96"
"Recording items","Todo List App should reflect the number of items left in the counter","SUCCESS","2023-08-08T22:11:32.773Z[Etc/UTC]","0.0","1.15"
"Recording items","Todo List App should show #main and #footer sections only when list contains items","SUCCESS","2023-08-08T22:11:33.931Z[Etc/UTC]","0.0","1.39"
