"Story","Title","Result","Date","Stability","Duration (s)"
"Multi-actor scenarios","Todo List App supports multiple actors using separate browsers","SUCCESS","2023-07-25T12:21:57.56Z[Etc/UTC]","0.0","8.61"
"Recording items","Todo List App should allow me to add todo items","SUCCESS","2023-07-25T12:22:06.186Z[Etc/UTC]","0.0","1.34"
"Recording items","Todo List App should clear text input field when an item is added","SUCCESS","2023-07-25T12:22:07.532Z[Etc/UTC]","0.0","1.09"
"Recording items","Todo List App should reflect the number of items left in the counter","SUCCESS","2023-07-25T12:22:08.627Z[Etc/UTC]","0.0","1.26"
"Recording items","Todo List App should show #main and #footer sections only when list contains items","SUCCESS","2023-07-25T12:22:09.9Z[Etc/UTC]","0.0","1.59"
