"Story","Title","Result","Date","Stability","Duration (s)"
"Multi-actor scenarios","Todo List App supports multiple actors using separate browsers","SUCCESS","2023-10-03T21:31:41.168Z[Etc/UTC]","0.0","3.15"
"Recording items","Todo List App should allow me to add todo items","SUCCESS","2023-10-03T21:31:44.345Z[Etc/UTC]","0.0","0.93"
"Recording items","Todo List App should clear text input field when an item is added","SUCCESS","2023-10-03T21:31:45.279Z[Etc/UTC]","0.0","0.8"
"Recording items","Todo List App should reflect the number of items left in the counter","SUCCESS","2023-10-03T21:31:46.085Z[Etc/UTC]","0.0","1.05"
"Recording items","Todo List App should show #main and #footer sections only when list contains items","SUCCESS","2023-10-03T21:31:47.142Z[Etc/UTC]","0.0","1.32"
