"Story","Title","Result","Date","Stability","Duration (s)"
"Multi-actor scenarios","Todo List App supports multiple actors using separate browsers","SUCCESS","2023-08-25T15:40:47.031Z[Etc/UTC]","0.0","3.17"
"Recording items","Todo List App should allow me to add todo items","SUCCESS","2023-08-25T15:40:50.221Z[Etc/UTC]","0.0","0.92"
"Recording items","Todo List App should clear text input field when an item is added","SUCCESS","2023-08-25T15:40:51.149Z[Etc/UTC]","0.0","0.76"
"Recording items","Todo List App should reflect the number of items left in the counter","SUCCESS","2023-08-25T15:40:51.928Z[Etc/UTC]","0.0","0.99"
"Recording items","Todo List App should show #main and #footer sections only when list contains items","SUCCESS","2023-08-25T15:40:52.929Z[Etc/UTC]","0.0","1.26"
