"Story","Title","Result","Date","Stability","Duration (s)"
"Multi-actor scenarios","Todo List App supports multiple actors using separate browsers","SUCCESS","2023-01-31T17:54:16.526Z[Etc/UTC]","0.0","1.6"
"Recording items","Todo List App should allow me to add todo items","SUCCESS","2023-01-31T17:54:18.135Z[Etc/UTC]","0.0","0.66"
"Recording items","Todo List App should clear text input field when an item is added","SUCCESS","2023-01-31T17:54:18.806Z[Etc/UTC]","0.0","0.52"
"Recording items","Todo List App should reflect the number of items left in the counter","SUCCESS","2023-01-31T17:54:19.333Z[Etc/UTC]","0.0","0.71"
"Recording items","Todo List App should show #main and #footer sections only when list contains items","SUCCESS","2023-01-31T17:54:20.056Z[Etc/UTC]","0.0","0.51"
