"Story","Title","Result","Date","Stability","Duration (s)"
"Multi-actor scenarios","Todo List App supports multiple actors using separate browsers","SUCCESS","2022-11-16T20:30:45.65Z[Etc/UTC]","0.0","1.28"
"Recording items","Todo List App should allow me to add todo items","SUCCESS","2022-11-16T20:30:46.941Z[Etc/UTC]","0.0","0.66"
"Recording items","Todo List App should clear text input field when an item is added","SUCCESS","2022-11-16T20:30:47.603Z[Etc/UTC]","0.0","0.52"
"Recording items","Todo List App should reflect the number of items left in the counter","SUCCESS","2022-11-16T20:30:48.125Z[Etc/UTC]","0.0","0.7"
"Recording items","Todo List App should show #main and #footer sections only when list contains items","SUCCESS","2022-11-16T20:30:48.836Z[Etc/UTC]","0.0","0.54"
