"Story","Title","Result","Date","Stability","Duration (s)"
"Multi-actor scenarios","Todo List App supports multiple actors using separate browsers","SUCCESS","2023-05-15T20:51:37.941Z[Etc/UTC]","0.0","5.89"
"Recording items","Todo List App should allow me to add todo items","SUCCESS","2023-05-15T20:51:43.853Z[Etc/UTC]","0.0","1.49"
"Recording items","Todo List App should clear text input field when an item is added","SUCCESS","2023-05-15T20:51:45.349Z[Etc/UTC]","0.0","1.2"
"Recording items","Todo List App should reflect the number of items left in the counter","SUCCESS","2023-05-15T20:51:46.564Z[Etc/UTC]","0.0","1.83"
"Recording items","Todo List App should show #main and #footer sections only when list contains items","SUCCESS","2023-05-15T20:51:48.401Z[Etc/UTC]","0.0","1.33"
