"Story","Title","Result","Date","Stability","Duration (s)"
"Multi-actor scenarios","Todo List App supports multiple actors using separate browsers","SUCCESS","2023-01-06T21:14:51.737Z[Etc/UTC]","0.0","3.91"
"Recording items","Todo List App should allow me to add todo items","SUCCESS","2023-01-06T21:14:55.665Z[Etc/UTC]","0.0","1.33"
"Recording items","Todo List App should clear text input field when an item is added","SUCCESS","2023-01-06T21:14:57.01Z[Etc/UTC]","0.0","1.16"
"Recording items","Todo List App should reflect the number of items left in the counter","SUCCESS","2023-01-06T21:14:58.178Z[Etc/UTC]","0.0","1.41"
"Recording items","Todo List App should show #main and #footer sections only when list contains items","SUCCESS","2023-01-06T21:14:59.606Z[Etc/UTC]","0.0","1.18"
