"Story","Title","Result","Date","Stability","Duration (s)"
"Recording items","Todo List App should allow me to add todo items","SUCCESS","2023-02-26T15:01:26.108Z[Etc/UTC]","0.0","0.8"
"Recording items","Todo List App should clear text input field when an item is added","SUCCESS","2023-02-26T15:01:26.923Z[Etc/UTC]","0.0","0.68"
"Recording items","Todo List App should reflect the number of items left in the counter","SUCCESS","2023-02-26T15:01:27.607Z[Etc/UTC]","0.0","0.9"
"Recording items","Todo List App should show #main and #footer sections only when list contains items","SUCCESS","2023-02-26T15:01:28.528Z[Etc/UTC]","0.0","0.79"
"Vanilla Playwright Test","New Todo should allow me to add todo items","SUCCESS","2023-02-26T15:01:29.327Z[Etc/UTC]","0.0","0.56"
"Vanilla Playwright Test","New Todo should clear text input field when an item is added","SUCCESS","2023-02-26T15:01:29.902Z[Etc/UTC]","0.0","0.47"
"Vanilla Playwright Test","New Todo should reflect the number of items left in the counter","SUCCESS","2023-02-26T15:01:30.383Z[Etc/UTC]","0.0","0.54"
"Vanilla Playwright Test","New Todo should show #main and #footer when items added","SUCCESS","2023-02-26T15:01:30.924Z[Etc/UTC]","0.0","0.49"
"Vanilla Playwright Test","New Todo should show #main and #footer when items added","SUCCESS","2023-02-26T15:01:44.506Z[Etc/UTC]","0.0","0.93"
