"Story","Title","Result","Date","Stability","Duration (s)"
"Multi-actor scenarios","Todo List App supports multiple actors using separate browsers","SUCCESS","2022-10-11T00:12:14.671Z[Etc/UTC]","0.0","1.4"
"Multi-actor scenarios","Todo List App supports multiple actors using separate browsers","SUCCESS","2022-10-11T00:12:20.525Z[Etc/UTC]","0.0","3.52"
"Multi-actor scenarios","Todo List App supports multiple actors using separate browsers","SUCCESS","2022-10-11T00:12:31.19Z[Etc/UTC]","0.0","3.57"
"Recording items","Todo List App should allow me to add todo items","SUCCESS","2022-10-11T00:12:34.773Z[Etc/UTC]","0.0","2.33"
"Recording items","Todo List App should reflect the number of items left in the counter","SUCCESS","2022-10-11T00:12:37.945Z[Etc/UTC]","0.0","1.17"
