"Story","Title","Result","Date","Stability","Duration (s)"
"Multi-actor scenarios","Todo List App supports multiple actors using separate browsers","SUCCESS","2023-01-29T04:12:36.242Z[Etc/UTC]","0.0","1.64"
"Multi-actor scenarios","Todo List App supports multiple actors using separate browsers","SUCCESS","2023-01-29T04:12:42.557Z[Etc/UTC]","0.0","2.81"
"Multi-actor scenarios","Todo List App supports multiple actors using separate browsers","SUCCESS","2023-01-29T04:12:52.527Z[Etc/UTC]","0.0","3.27"
"Recording items","Todo List App should allow me to add todo items","SUCCESS","2023-01-29T04:12:55.817Z[Etc/UTC]","0.0","1.1"
"Recording items","Todo List App should reflect the number of items left in the counter","SUCCESS","2023-01-29T04:12:57.865Z[Etc/UTC]","0.0","1.17"
"Recording items","Todo List App should show #main and #footer sections only when list contains items","SUCCESS","2023-01-29T04:12:59.046Z[Etc/UTC]","0.0","1.02"
