"Story","Title","Result","Date","Stability","Duration (s)"
"Multi-actor scenarios","Todo List App supports multiple actors","SUCCESS","2022-10-05T16:21:41.413Z[Etc/UTC]","0.0","1.44"
"Multi-actor scenarios","Todo List App supports multiple actors","SUCCESS","2022-10-05T16:21:47.551Z[Etc/UTC]","0.0","3.65"
"Multi-actor scenarios","Todo List App supports multiple actors","SUCCESS","2022-10-05T16:21:58.681Z[Etc/UTC]","0.0","4.73"
"Recording items","Todo List App should allow me to add todo items","SUCCESS","2022-10-05T16:22:03.428Z[Etc/UTC]","0.0","1.27"
"Recording items","Todo List App should reflect the number of items left in the counter","SUCCESS","2022-10-05T16:22:05.635Z[Etc/UTC]","0.0","1.16"
