"Story","Title","Result","Date","Stability","Duration (s)"
"Multi-actor scenarios","Todo List App supports multiple actors using separate browsers","SUCCESS","2023-04-04T13:34:58.061Z[Etc/UTC]","0.0","4.12"
"Recording items","Todo List App should allow me to add todo items","SUCCESS","2023-04-04T13:35:02.199Z[Etc/UTC]","0.0","1.31"
"Recording items","Todo List App should clear text input field when an item is added","SUCCESS","2023-04-04T13:35:03.519Z[Etc/UTC]","0.0","1.09"
"Recording items","Todo List App should reflect the number of items left in the counter","SUCCESS","2023-04-04T13:35:04.621Z[Etc/UTC]","0.0","1.53"
"Recording items","Todo List App should show #main and #footer sections only when list contains items","SUCCESS","2023-04-04T13:35:06.16Z[Etc/UTC]","0.0","1.1"
