"Story","Title","Result","Date","Stability","Duration (s)"
"Multi-actor scenarios","Todo List App supports multiple actors using separate browsers","SUCCESS","2022-10-08T03:35:47.619Z[Etc/UTC]","0.0","2.86"
"Recording items","Todo List App should allow me to add todo items","SUCCESS","2022-10-08T03:35:50.487Z[Etc/UTC]","0.0","0.83"
"Recording items","Todo List App should clear text input field when an item is added","SUCCESS","2022-10-08T03:35:51.325Z[Etc/UTC]","0.0","0.7"
"Recording items","Todo List App should reflect the number of items left in the counter","SUCCESS","2022-10-08T03:35:52.036Z[Etc/UTC]","0.0","0.93"
"Recording items","Todo List App should show #main and #footer sections only when list contains items","SUCCESS","2022-10-08T03:35:52.982Z[Etc/UTC]","0.0","0.75"
