"Story","Title","Result","Date","Stability","Duration (s)"
"Multi-actor scenarios","Todo List App supports multiple actors using separate browsers","SUCCESS","2022-10-26T16:43:49.007Z[Etc/UTC]","0.0","2.98"
"Recording items","Todo List App should allow me to add todo items","SUCCESS","2022-10-26T16:43:52.006Z[Etc/UTC]","0.0","0.91"
"Recording items","Todo List App should clear text input field when an item is added","SUCCESS","2022-10-26T16:43:52.928Z[Etc/UTC]","0.0","0.73"
"Recording items","Todo List App should reflect the number of items left in the counter","SUCCESS","2022-10-26T16:43:53.668Z[Etc/UTC]","0.0","0.99"
"Recording items","Todo List App should show #main and #footer sections only when list contains items","SUCCESS","2022-10-26T16:43:54.668Z[Etc/UTC]","0.0","0.78"
