"Story","Title","Result","Date","Stability","Duration (s)"
"Multi-actor scenarios","Todo List App supports multiple actors using separate browsers","SUCCESS","2023-03-22T06:26:32.207Z[Etc/UTC]","0.0","4.02"
"Recording items","Todo List App should allow me to add todo items","SUCCESS","2023-03-22T06:26:36.24Z[Etc/UTC]","0.0","1.06"
"Recording items","Todo List App should clear text input field when an item is added","SUCCESS","2023-03-22T06:26:37.309Z[Etc/UTC]","0.0","0.83"
"Recording items","Todo List App should reflect the number of items left in the counter","SUCCESS","2023-03-22T06:26:38.154Z[Etc/UTC]","0.0","1.16"
"Recording items","Todo List App should show #main and #footer sections only when list contains items","SUCCESS","2023-03-22T06:26:39.322Z[Etc/UTC]","0.0","0.84"
