"Story","Title","Result","Date","Stability","Duration (s)"
"Multi-actor scenarios","Todo List App supports multiple actors using separate browsers","SUCCESS","2023-03-24T15:48:37.631Z[Etc/UTC]","0.0","4.29"
"Recording items","Todo List App should allow me to add todo items","SUCCESS","2023-03-24T15:48:41.935Z[Etc/UTC]","0.0","0.97"
"Recording items","Todo List App should clear text input field when an item is added","SUCCESS","2023-03-24T15:48:42.915Z[Etc/UTC]","0.0","0.72"
"Recording items","Todo List App should reflect the number of items left in the counter","SUCCESS","2023-03-24T15:48:43.651Z[Etc/UTC]","0.0","1.07"
"Recording items","Todo List App should show #main and #footer sections only when list contains items","SUCCESS","2023-03-24T15:48:44.722Z[Etc/UTC]","0.0","0.84"
