"Story","Title","Result","Date","Stability","Duration (s)"
"Multi-actor scenarios","Todo List App supports multiple actors using separate browsers","SUCCESS","2023-04-03T01:09:20.645Z[Etc/UTC]","0.0","3.04"
"Recording items","Todo List App should allow me to add todo items","SUCCESS","2023-04-03T01:09:23.717Z[Etc/UTC]","0.0","0.97"
"Recording items","Todo List App should clear text input field when an item is added","SUCCESS","2023-04-03T01:09:24.693Z[Etc/UTC]","0.0","0.74"
"Recording items","Todo List App should reflect the number of items left in the counter","SUCCESS","2023-04-03T01:09:25.445Z[Etc/UTC]","0.0","1.15"
"Recording items","Todo List App should show #main and #footer sections only when list contains items","SUCCESS","2023-04-03T01:09:26.601Z[Etc/UTC]","0.0","0.85"
