"Story","Title","Result","Date","Stability","Duration (s)"
"Multi-actor scenarios","Todo List App supports multiple actors using separate browsers","SUCCESS","2023-03-07T09:34:29.278Z[Etc/UTC]","0.0","1.37"
"Recording items","Todo List App should allow me to add todo items","SUCCESS","2023-03-07T09:34:30.664Z[Etc/UTC]","0.0","0.58"
"Recording items","Todo List App should clear text input field when an item is added","SUCCESS","2023-03-07T09:34:31.251Z[Etc/UTC]","0.0","0.48"
"Recording items","Todo List App should reflect the number of items left in the counter","SUCCESS","2023-03-07T09:34:31.73Z[Etc/UTC]","0.0","0.68"
"Recording items","Todo List App should show #main and #footer sections only when list contains items","SUCCESS","2023-03-07T09:34:32.418Z[Etc/UTC]","0.0","0.5"
