"Story","Title","Result","Date","Stability","Duration (s)"
"Multi-actor scenarios","Todo List App supports multiple actors using separate browsers","SUCCESS","2022-10-08T03:35:41.825Z[Etc/UTC]","0.0","1.34"
"Multi-actor scenarios","Todo List App supports multiple actors using separate browsers","SUCCESS","2022-10-08T03:35:47.619Z[Etc/UTC]","0.0","2.86"
"Multi-actor scenarios","Todo List App supports multiple actors using separate browsers","SUCCESS","2022-10-08T03:35:57.472Z[Etc/UTC]","0.0","3.2"
"Recording items","Todo List App should allow me to add todo items","SUCCESS","2022-10-08T03:36:00.689Z[Etc/UTC]","0.0","1.03"
"Recording items","Todo List App should reflect the number of items left in the counter","SUCCESS","2022-10-08T03:36:02.664Z[Etc/UTC]","0.0","1.07"
