"Story","Title","Result","Date","Stability","Duration (s)"
"Multi-actor scenarios","Todo List App supports multiple actors using separate browsers","SUCCESS","2023-01-12T03:46:33.711Z[Etc/UTC]","0.0","3.76"
"Recording items","Todo List App should allow me to add todo items","SUCCESS","2023-01-12T03:46:37.488Z[Etc/UTC]","0.0","1.06"
"Recording items","Todo List App should clear text input field when an item is added","SUCCESS","2023-01-12T03:46:38.569Z[Etc/UTC]","0.0","0.85"
"Recording items","Todo List App should reflect the number of items left in the counter","SUCCESS","2023-01-12T03:46:39.431Z[Etc/UTC]","0.0","1.19"
"Recording items","Todo List App should show #main and #footer sections only when list contains items","SUCCESS","2023-01-12T03:46:40.648Z[Etc/UTC]","0.0","0.96"
