"Story","Title","Result","Date","Stability","Duration (s)"
"Multi-actor scenarios","Todo List App supports multiple actors using separate browsers","SUCCESS","2023-03-21T17:07:51.344Z[Etc/UTC]","0.0","1.33"
"Recording items","Todo List App should allow me to add todo items","SUCCESS","2023-03-21T17:07:52.684Z[Etc/UTC]","0.0","0.77"
"Recording items","Todo List App should clear text input field when an item is added","SUCCESS","2023-03-21T17:07:53.456Z[Etc/UTC]","0.0","0.51"
"Recording items","Todo List App should reflect the number of items left in the counter","SUCCESS","2023-03-21T17:07:53.967Z[Etc/UTC]","0.0","0.95"
"Recording items","Todo List App should show #main and #footer sections only when list contains items","SUCCESS","2023-03-21T17:07:54.927Z[Etc/UTC]","0.0","0.63"
