"Story","Title","Result","Date","Stability","Duration (s)"
"Multi-actor scenarios","Todo List App supports multiple actors using separate browsers","SUCCESS","2023-03-22T06:26:25.294Z[Etc/UTC]","0.0","1.82"
"Recording items","Todo List App should allow me to add todo items","SUCCESS","2023-03-22T06:26:27.13Z[Etc/UTC]","0.0","0.85"
"Recording items","Todo List App should clear text input field when an item is added","SUCCESS","2023-03-22T06:26:27.981Z[Etc/UTC]","0.0","0.61"
"Recording items","Todo List App should reflect the number of items left in the counter","SUCCESS","2023-03-22T06:26:28.597Z[Etc/UTC]","0.0","0.94"
"Recording items","Todo List App should show #main and #footer sections only when list contains items","SUCCESS","2023-03-22T06:26:29.556Z[Etc/UTC]","0.0","0.51"
