"Story","Title","Result","Date","Stability","Duration (s)"
"Multi-actor scenarios","Todo List App supports multiple actors using separate browsers","SUCCESS","2023-02-28T00:55:11.488Z[Etc/UTC]","0.0","3.1"
"Recording items","Todo List App should allow me to add todo items","SUCCESS","2023-02-28T00:55:14.595Z[Etc/UTC]","0.0","0.92"
"Recording items","Todo List App should clear text input field when an item is added","SUCCESS","2023-02-28T00:55:15.525Z[Etc/UTC]","0.0","0.77"
"Recording items","Todo List App should reflect the number of items left in the counter","SUCCESS","2023-02-28T00:55:16.314Z[Etc/UTC]","0.0","0.99"
"Recording items","Todo List App should show #main and #footer sections only when list contains items","SUCCESS","2023-02-28T00:55:17.308Z[Etc/UTC]","0.0","0.82"
