"Story","Title","Result","Date","Stability","Duration (s)"
"Multi-actor scenarios","Todo List App supports multiple actors using separate browsers","SUCCESS","2023-02-22T02:00:23.631Z[Etc/UTC]","0.0","4.72"
"Recording items","Todo List App should allow me to add todo items","SUCCESS","2023-02-22T02:00:28.372Z[Etc/UTC]","0.0","0.88"
"Recording items","Todo List App should clear text input field when an item is added","SUCCESS","2023-02-22T02:00:29.269Z[Etc/UTC]","0.0","0.75"
"Recording items","Todo List App should reflect the number of items left in the counter","SUCCESS","2023-02-22T02:00:30.022Z[Etc/UTC]","0.0","1.01"
"Recording items","Todo List App should show #main and #footer sections only when list contains items","SUCCESS","2023-02-22T02:00:31.039Z[Etc/UTC]","0.0","0.82"
