"Story","Title","Result","Date","Stability","Duration (s)"
"Multi-actor scenarios","Todo List App supports multiple actors using separate browsers","SUCCESS","2023-03-19T22:14:51.48Z[Etc/UTC]","0.0","6.82"
"Recording items","Todo List App should allow me to add todo items","SUCCESS","2023-03-19T22:14:58.357Z[Etc/UTC]","0.0","1.42"
"Recording items","Todo List App should clear text input field when an item is added","SUCCESS","2023-03-19T22:14:59.783Z[Etc/UTC]","0.0","1.02"
"Recording items","Todo List App should reflect the number of items left in the counter","SUCCESS","2023-03-19T22:15:00.816Z[Etc/UTC]","0.0","1.24"
"Recording items","Todo List App should show #main and #footer sections only when list contains items","SUCCESS","2023-03-19T22:15:02.067Z[Etc/UTC]","0.0","0.96"
