"Story","Title","Result","Date","Stability","Duration (s)"
"Multi-actor scenarios","Todo List App supports multiple actors using separate browsers","SUCCESS","2023-04-03T01:09:14.047Z[Etc/UTC]","0.0","1.78"
"Recording items","Todo List App should allow me to add todo items","SUCCESS","2023-04-03T01:09:15.845Z[Etc/UTC]","0.0","0.73"
"Recording items","Todo List App should clear text input field when an item is added","SUCCESS","2023-04-03T01:09:16.578Z[Etc/UTC]","0.0","0.51"
"Recording items","Todo List App should reflect the number of items left in the counter","SUCCESS","2023-04-03T01:09:17.087Z[Etc/UTC]","0.0","0.85"
"Recording items","Todo List App should show #main and #footer sections only when list contains items","SUCCESS","2023-04-03T01:09:17.939Z[Etc/UTC]","0.0","0.61"
