"Story","Title","Result","Date","Stability","Duration (s)"
"Multi-actor scenarios","Todo List App supports multiple actors using separate browsers","SUCCESS","2023-03-23T10:56:40.873Z[Etc/UTC]","0.0","3.18"
"Recording items","Todo List App should allow me to add todo items","SUCCESS","2023-03-23T10:56:44.069Z[Etc/UTC]","0.0","0.95"
"Recording items","Todo List App should clear text input field when an item is added","SUCCESS","2023-03-23T10:56:45.024Z[Etc/UTC]","0.0","0.72"
"Recording items","Todo List App should reflect the number of items left in the counter","SUCCESS","2023-03-23T10:56:45.754Z[Etc/UTC]","0.0","1.17"
"Recording items","Todo List App should show #main and #footer sections only when list contains items","SUCCESS","2023-03-23T10:56:46.941Z[Etc/UTC]","0.0","0.73"
