"Story","Title","Result","Date","Stability","Duration (s)"
"Multi-actor scenarios","Todo List App supports multiple actors using separate browsers","SUCCESS","2023-03-24T16:15:13.75Z[Etc/UTC]","0.0","1.77"
"Recording items","Todo List App should allow me to add todo items","SUCCESS","2023-03-24T16:15:15.53Z[Etc/UTC]","0.0","0.84"
"Recording items","Todo List App should clear text input field when an item is added","SUCCESS","2023-03-24T16:15:16.375Z[Etc/UTC]","0.0","0.61"
"Recording items","Todo List App should reflect the number of items left in the counter","SUCCESS","2023-03-24T16:15:16.994Z[Etc/UTC]","0.0","0.87"
"Recording items","Todo List App should show #main and #footer sections only when list contains items","SUCCESS","2023-03-24T16:15:17.876Z[Etc/UTC]","0.0","0.64"
