"Story","Title","Result","Date","Stability","Duration (s)"
"Multi-actor scenarios","Todo List App supports multiple actors using separate browsers","SUCCESS","2023-04-16T06:57:40.665Z[Etc/UTC]","0.0","1.59"
"Recording items","Todo List App should allow me to add todo items","SUCCESS","2023-04-16T06:57:42.272Z[Etc/UTC]","0.0","0.74"
"Recording items","Todo List App should clear text input field when an item is added","SUCCESS","2023-04-16T06:57:43.023Z[Etc/UTC]","0.0","0.61"
"Recording items","Todo List App should reflect the number of items left in the counter","SUCCESS","2023-04-16T06:57:43.637Z[Etc/UTC]","0.0","0.94"
"Recording items","Todo List App should show #main and #footer sections only when list contains items","SUCCESS","2023-04-16T06:57:44.587Z[Etc/UTC]","0.0","0.62"
