"Story","Title","Result","Date","Stability","Duration (s)"
"Vanilla Playwright Test","New Todo should reflect the number of items left in the counter","SUCCESS","2023-03-24T16:44:52.418Z[Etc/UTC]","0.0","1.07"
"Vanilla Playwright Test","New Todo should allow me to add todo items","SUCCESS","2023-03-24T16:45:07.783Z[Etc/UTC]","0.0","1.12"
"Vanilla Playwright Test","New Todo should clear text input field when an item is added","SUCCESS","2023-03-24T16:45:08.903Z[Etc/UTC]","0.0","1.01"
"Vanilla Playwright Test","New Todo should reflect the number of items left in the counter","SUCCESS","2023-03-24T16:45:09.918Z[Etc/UTC]","0.0","1.3"
"Vanilla Playwright Test","New Todo should show #main and #footer when items added","SUCCESS","2023-03-24T16:45:11.215Z[Etc/UTC]","0.0","1.2"
