"Story","Title","Result","Date","Stability","Duration (s)"
"Multi-actor scenarios","Todo List App supports multiple actors using separate browsers","SUCCESS","2022-10-26T16:31:41.906Z[Etc/UTC]","0.0","2.73"
"Recording items","Todo List App should allow me to add todo items","SUCCESS","2022-10-26T16:31:44.67Z[Etc/UTC]","0.0","0.63"
"Recording items","Todo List App should clear text input field when an item is added","SUCCESS","2022-10-26T16:31:45.306Z[Etc/UTC]","0.0","0.53"
"Recording items","Todo List App should reflect the number of items left in the counter","SUCCESS","2022-10-26T16:31:45.836Z[Etc/UTC]","0.0","0.7"
"Recording items","Todo List App should show #main and #footer sections only when list contains items","SUCCESS","2022-10-26T16:31:46.543Z[Etc/UTC]","0.0","0.56"
