"Story","Title","Result","Date","Stability","Duration (s)"
"Multi-actor scenarios","Todo List App supports multiple actors using separate browsers","SUCCESS","2022-12-12T16:02:35.377Z[Etc/UTC]","0.0","1.57"
"Multi-actor scenarios","Todo List App supports multiple actors using separate browsers","SUCCESS","2022-12-12T16:02:42.29Z[Etc/UTC]","0.0","3.23"
"Recording items","Todo List App should reflect the number of items left in the counter","SUCCESS","2022-12-12T16:02:47.286Z[Etc/UTC]","0.0","1.05"
"Multi-actor scenarios","Todo List App supports multiple actors using separate browsers","SUCCESS","2022-12-12T16:02:53.368Z[Etc/UTC]","0.0","3.38"
"Recording items","Todo List App should allow me to add todo items","SUCCESS","2022-12-12T16:02:56.766Z[Etc/UTC]","0.0","1.1"
"Recording items","Todo List App should clear text input field when an item is added","SUCCESS","2022-12-12T16:02:57.875Z[Etc/UTC]","0.0","1.0"
"Recording items","Todo List App should reflect the number of items left in the counter","SUCCESS","2022-12-12T16:02:58.883Z[Etc/UTC]","0.0","1.19"
"Recording items","Todo List App should show #main and #footer sections only when list contains items","SUCCESS","2022-12-12T16:03:00.086Z[Etc/UTC]","0.0","1.0"
