"Story","Title","Result","Date","Stability","Duration (s)"
"Multi-actor scenarios","Todo List App supports multiple actors using separate browsers","SUCCESS","2022-12-03T05:39:19.959Z[Etc/UTC]","0.0","3.11"
"Recording items","Todo List App should allow me to add todo items","SUCCESS","2022-12-03T05:39:23.08Z[Etc/UTC]","0.0","0.9"
"Recording items","Todo List App should clear text input field when an item is added","SUCCESS","2022-12-03T05:39:23.985Z[Etc/UTC]","0.0","0.77"
"Recording items","Todo List App should reflect the number of items left in the counter","SUCCESS","2022-12-03T05:39:24.763Z[Etc/UTC]","0.0","1.02"
"Recording items","Todo List App should show #main and #footer sections only when list contains items","SUCCESS","2022-12-03T05:39:25.783Z[Etc/UTC]","0.0","0.83"
