"Story","Title","Result","Date","Stability","Duration (s)"
"Multi-actor scenarios","Todo List App supports multiple actors using separate browsers","SUCCESS","2022-11-21T05:39:22.323Z[Etc/UTC]","0.0","3.54"
"Recording items","Todo List App should allow me to add todo items","SUCCESS","2022-11-21T05:39:25.875Z[Etc/UTC]","0.0","0.85"
"Recording items","Todo List App should clear text input field when an item is added","SUCCESS","2022-11-21T05:39:26.74Z[Etc/UTC]","0.0","0.69"
"Recording items","Todo List App should reflect the number of items left in the counter","SUCCESS","2022-11-21T05:39:27.429Z[Etc/UTC]","0.0","0.99"
"Recording items","Todo List App should show #main and #footer sections only when list contains items","SUCCESS","2022-11-21T05:39:28.424Z[Etc/UTC]","0.0","0.75"
