"Story","Title","Result","Date","Stability","Duration (s)"
"Recording items","Todo List App should reflect the number of items left in the counter","SUCCESS","2023-04-06T05:37:28.545Z[Etc/UTC]","0.0","1.25"
"Recording items","Todo List App should allow me to add todo items","SUCCESS","2023-04-06T05:37:37.555Z[Etc/UTC]","0.0","1.05"
"Recording items","Todo List App should clear text input field when an item is added","SUCCESS","2023-04-06T05:37:38.609Z[Etc/UTC]","0.0","1.04"
"Recording items","Todo List App should reflect the number of items left in the counter","SUCCESS","2023-04-06T05:37:39.658Z[Etc/UTC]","0.0","1.27"
"Recording items","Todo List App should show #main and #footer sections only when list contains items","SUCCESS","2023-04-06T05:37:40.929Z[Etc/UTC]","0.0","1.09"
