"Story","Title","Result","Date","Stability","Duration (s)"
"Recording items","Todo List App should allow me to add todo items","SUCCESS","2023-03-21T17:08:00.878Z[Etc/UTC]","0.0","1.09"
"Recording items","Todo List App should reflect the number of items left in the counter","SUCCESS","2023-03-21T17:08:02.831Z[Etc/UTC]","0.0","1.26"
"Recording items","Todo List App should allow me to add todo items","SUCCESS","2023-03-21T17:08:13.949Z[Etc/UTC]","0.0","1.27"
"Recording items","Todo List App should clear text input field when an item is added","SUCCESS","2023-03-21T17:08:15.221Z[Etc/UTC]","0.0","1.03"
"Recording items","Todo List App should reflect the number of items left in the counter","SUCCESS","2023-03-21T17:08:16.271Z[Etc/UTC]","0.0","1.35"
"Recording items","Todo List App should show #main and #footer sections only when list contains items","SUCCESS","2023-03-21T17:08:17.638Z[Etc/UTC]","0.0","1.07"
