"Story","Title","Result","Date","Stability","Duration (s)"
"Recording items","Todo List App should reflect the number of items left in the counter","SUCCESS","2023-05-25T04:33:22.878Z[Etc/UTC]","0.0","1.06"
"Recording items","Todo List App should reflect the number of items left in the counter","SUCCESS","2023-05-25T04:33:31.664Z[Etc/UTC]","0.0","1.27"
"Recording items","Todo List App should allow me to add todo items","SUCCESS","2023-05-25T04:33:40.978Z[Etc/UTC]","0.0","1.15"
"Recording items","Todo List App should clear text input field when an item is added","SUCCESS","2023-05-25T04:33:42.141Z[Etc/UTC]","0.0","1.03"
"Recording items","Todo List App should reflect the number of items left in the counter","SUCCESS","2023-05-25T04:33:43.179Z[Etc/UTC]","0.0","1.45"
