"Story","Title","Result","Date","Stability","Duration (s)"
"Multi-actor scenarios","Todo List App supports multiple actors using separate browsers","SUCCESS","2023-03-24T16:12:55.084Z[Etc/UTC]","0.0","2.25"
"Recording items","Todo List App should allow me to add todo items","SUCCESS","2023-03-24T16:12:57.348Z[Etc/UTC]","0.0","0.83"
"Recording items","Todo List App should clear text input field when an item is added","SUCCESS","2023-03-24T16:12:58.179Z[Etc/UTC]","0.0","0.52"
"Recording items","Todo List App should reflect the number of items left in the counter","SUCCESS","2023-03-24T16:12:58.702Z[Etc/UTC]","0.0","0.76"
"Recording items","Todo List App should show #main and #footer sections only when list contains items","SUCCESS","2023-03-24T16:12:59.474Z[Etc/UTC]","0.0","0.52"
