"Story","Title","Result","Date","Stability","Duration (s)"
"Multi-actor scenarios","Todo List App supports multiple actors using separate browsers","SUCCESS","2023-03-24T15:48:29.968Z[Etc/UTC]","0.0","3.01"
"Recording items","Todo List App should allow me to add todo items","SUCCESS","2023-03-24T15:48:32.988Z[Etc/UTC]","0.0","0.64"
"Recording items","Todo List App should clear text input field when an item is added","SUCCESS","2023-03-24T15:48:33.63Z[Etc/UTC]","0.0","0.5"
"Recording items","Todo List App should reflect the number of items left in the counter","SUCCESS","2023-03-24T15:48:34.131Z[Etc/UTC]","0.0","0.75"
"Recording items","Todo List App should show #main and #footer sections only when list contains items","SUCCESS","2023-03-24T15:48:34.894Z[Etc/UTC]","0.0","0.63"
