"Story","Title","Result","Date","Stability","Duration (s)"
"Multi-actor scenarios","Todo List App supports multiple actors using separate browsers","SUCCESS","2023-05-26T18:40:38.429Z[Etc/UTC]","0.0","3.17"
"Recording items","Todo List App should allow me to add todo items","SUCCESS","2023-05-26T18:40:41.613Z[Etc/UTC]","0.0","0.98"
"Recording items","Todo List App should clear text input field when an item is added","SUCCESS","2023-05-26T18:40:42.6Z[Etc/UTC]","0.0","0.88"
"Recording items","Todo List App should reflect the number of items left in the counter","SUCCESS","2023-05-26T18:40:43.495Z[Etc/UTC]","0.0","1.28"
"Recording items","Todo List App should show #main and #footer sections only when list contains items","SUCCESS","2023-05-26T18:40:44.781Z[Etc/UTC]","0.0","0.87"
