"Story","Title","Result","Date","Stability","Duration (s)"
"Multi-actor scenarios","Todo List App supports multiple actors using separate browsers","SUCCESS","2023-04-11T03:34:53.779Z[Etc/UTC]","0.0","2.98"
"Recording items","Todo List App should allow me to add todo items","SUCCESS","2023-04-11T03:34:56.767Z[Etc/UTC]","0.0","0.96"
"Recording items","Todo List App should clear text input field when an item is added","SUCCESS","2023-04-11T03:34:57.735Z[Etc/UTC]","0.0","0.74"
"Recording items","Todo List App should reflect the number of items left in the counter","SUCCESS","2023-04-11T03:34:58.485Z[Etc/UTC]","0.0","1.16"
"Recording items","Todo List App should show #main and #footer sections only when list contains items","SUCCESS","2023-04-11T03:34:59.646Z[Etc/UTC]","0.0","0.85"
