"Story","Title","Result","Date","Stability","Duration (s)"
"Multi-actor scenarios","Todo List App supports multiple actors using separate browsers","SUCCESS","2023-04-06T05:37:23.672Z[Etc/UTC]","0.0","3.15"
"Recording items","Todo List App should allow me to add todo items","SUCCESS","2023-04-06T05:37:26.837Z[Etc/UTC]","0.0","0.95"
"Recording items","Todo List App should clear text input field when an item is added","SUCCESS","2023-04-06T05:37:27.791Z[Etc/UTC]","0.0","0.74"
"Recording items","Todo List App should reflect the number of items left in the counter","SUCCESS","2023-04-06T05:37:28.545Z[Etc/UTC]","0.0","1.25"
"Recording items","Todo List App should show #main and #footer sections only when list contains items","SUCCESS","2023-04-06T05:37:29.802Z[Etc/UTC]","0.0","0.75"
