"Story","Title","Result","Date","Stability","Duration (s)"
"Multi-actor scenarios","Todo List App supports multiple actors using separate browsers","SUCCESS","2023-05-20T07:11:24.774Z[Etc/UTC]","0.0","1.92"
"Recording items","Todo List App should allow me to add todo items","SUCCESS","2023-05-20T07:11:26.702Z[Etc/UTC]","0.0","0.96"
"Recording items","Todo List App should clear text input field when an item is added","SUCCESS","2023-05-20T07:11:27.671Z[Etc/UTC]","0.0","0.63"
"Recording items","Todo List App should reflect the number of items left in the counter","SUCCESS","2023-05-20T07:11:28.304Z[Etc/UTC]","0.0","1.06"
"Recording items","Todo List App should show #main and #footer sections only when list contains items","SUCCESS","2023-05-20T07:11:29.376Z[Etc/UTC]","0.0","0.73"
