"Story","Title","Result","Date","Stability","Duration (s)"
"Multi-actor scenarios","Todo List App supports multiple actors using separate browsers","SUCCESS","2023-05-06T23:10:50.3Z[Etc/UTC]","0.0","3.09"
"Recording items","Todo List App should allow me to add todo items","SUCCESS","2023-05-06T23:10:53.404Z[Etc/UTC]","0.0","0.97"
"Recording items","Todo List App should clear text input field when an item is added","SUCCESS","2023-05-06T23:10:54.381Z[Etc/UTC]","0.0","0.73"
"Recording items","Todo List App should reflect the number of items left in the counter","SUCCESS","2023-05-06T23:10:55.119Z[Etc/UTC]","0.0","1.26"
"Recording items","Todo List App should show #main and #footer sections only when list contains items","SUCCESS","2023-05-06T23:10:56.387Z[Etc/UTC]","0.0","0.87"
