"Story","Title","Result","Date","Stability","Duration (s)"
"Multi-actor scenarios","Todo List App supports multiple actors","SUCCESS","2022-10-05T23:01:40.915Z[Etc/UTC]","0.0","1.78"
"Recording items","Todo List App should allow me to add todo items","SUCCESS","2022-10-05T23:01:42.715Z[Etc/UTC]","0.0","0.76"
"Recording items","Todo List App should clear text input field when an item is added","SUCCESS","2022-10-05T23:01:43.48Z[Etc/UTC]","0.0","0.61"
"Recording items","Todo List App should reflect the number of items left in the counter","SUCCESS","2022-10-05T23:01:44.1Z[Etc/UTC]","0.0","0.82"
"Recording items","Todo List App should show #main and #footer sections only when list contains items","SUCCESS","2022-10-05T23:01:44.925Z[Etc/UTC]","0.0","0.64"
