"Story","Title","Result","Date","Stability","Duration (s)"
"Multi-actor scenarios","Todo List App supports multiple actors using separate browsers","SUCCESS","2023-03-23T04:13:18.184Z[Etc/UTC]","0.0","3.52"
"Recording items","Todo List App should allow me to add todo items","SUCCESS","2023-03-23T04:13:21.724Z[Etc/UTC]","0.0","1.24"
"Recording items","Todo List App should clear text input field when an item is added","SUCCESS","2023-03-23T04:13:22.972Z[Etc/UTC]","0.0","1.1"
"Recording items","Todo List App should reflect the number of items left in the counter","SUCCESS","2023-03-23T04:13:24.094Z[Etc/UTC]","0.0","1.44"
"Recording items","Todo List App should show #main and #footer sections only when list contains items","SUCCESS","2023-03-23T04:13:25.544Z[Etc/UTC]","0.0","1.15"
