"Story","Title","Result","Date","Stability","Duration (s)"
"Multi-actor scenarios","Todo List App supports multiple actors using separate browsers","SUCCESS","2023-03-04T09:10:59.363Z[Etc/UTC]","0.0","11.9"
"Recording items","Todo List App should allow me to add todo items","SUCCESS","2023-03-04T09:11:11.282Z[Etc/UTC]","0.0","1.28"
"Recording items","Todo List App should clear text input field when an item is added","SUCCESS","2023-03-04T09:11:12.57Z[Etc/UTC]","0.0","1.07"
"Recording items","Todo List App should reflect the number of items left in the counter","SUCCESS","2023-03-04T09:11:13.655Z[Etc/UTC]","0.0","1.31"
"Recording items","Todo List App should show #main and #footer sections only when list contains items","SUCCESS","2023-03-04T09:11:14.985Z[Etc/UTC]","0.0","1.12"
