"Story","Title","Result","Date","Stability","Duration (s)"
"Multi-actor scenarios","Todo List App supports multiple actors using separate browsers","SUCCESS","2023-04-08T06:08:56.912Z[Etc/UTC]","0.0","9.79"
"Recording items","Todo List App should allow me to add todo items","SUCCESS","2023-04-08T06:09:06.712Z[Etc/UTC]","0.0","1.61"
"Recording items","Todo List App should clear text input field when an item is added","SUCCESS","2023-04-08T06:09:08.333Z[Etc/UTC]","0.0","1.4"
"Recording items","Todo List App should reflect the number of items left in the counter","SUCCESS","2023-04-08T06:09:09.747Z[Etc/UTC]","0.0","1.53"
"Recording items","Todo List App should show #main and #footer sections only when list contains items","SUCCESS","2023-04-08T06:09:11.289Z[Etc/UTC]","0.0","1.28"
