"Story","Title","Result","Date","Stability","Duration (s)"
"Multi-actor scenarios","Todo List App supports multiple actors using separate browsers","SUCCESS","2023-01-06T06:44:05.208Z[Etc/UTC]","0.0","8.08"
"Recording items","Todo List App should allow me to add todo items","SUCCESS","2023-01-06T06:44:13.307Z[Etc/UTC]","0.0","1.22"
"Recording items","Todo List App should clear text input field when an item is added","SUCCESS","2023-01-06T06:44:14.531Z[Etc/UTC]","0.0","1.01"
"Recording items","Todo List App should reflect the number of items left in the counter","SUCCESS","2023-01-06T06:44:15.554Z[Etc/UTC]","0.0","1.24"
"Recording items","Todo List App should show #main and #footer sections only when list contains items","SUCCESS","2023-01-06T06:44:16.8Z[Etc/UTC]","0.0","1.08"
