"Story","Title","Result","Date","Stability","Duration (s)"
"Vanilla Playwright Test","New Todo should allow me to add todo items","SUCCESS","2022-12-19T22:13:45.113Z[Etc/UTC]","0.0","0.59"
"Vanilla Playwright Test","New Todo should clear text input field when an item is added","SUCCESS","2022-12-19T22:13:45.708Z[Etc/UTC]","0.0","0.52"
"Vanilla Playwright Test","New Todo should reflect the number of items left in the counter","SUCCESS","2022-12-19T22:13:46.229Z[Etc/UTC]","0.0","0.63"
"Vanilla Playwright Test","New Todo should show #main and #footer when items added","SUCCESS","2022-12-19T22:13:46.866Z[Etc/UTC]","0.0","0.53"
"Vanilla Playwright Test","New Todo should clear text input field when an item is added","SUCCESS","2022-12-19T22:14:00.843Z[Etc/UTC]","0.0","0.94"
