"Story","Title","Result","Date","Stability","Duration (s)"
"Recording items","Todo List App should allow me to add todo items","SUCCESS","2022-12-20T23:24:37.095Z[Etc/UTC]","0.0","0.77"
"Recording items","Todo List App should clear text input field when an item is added","SUCCESS","2022-12-20T23:24:37.876Z[Etc/UTC]","0.0","0.59"
"Recording items","Todo List App should reflect the number of items left in the counter","SUCCESS","2022-12-20T23:24:38.468Z[Etc/UTC]","0.0","0.89"
"Recording items","Todo List App should show #main and #footer sections only when list contains items","SUCCESS","2022-12-20T23:24:39.365Z[Etc/UTC]","0.0","0.71"
"Vanilla Playwright Test","New Todo should allow me to add todo items","SUCCESS","2022-12-20T23:24:40.08Z[Etc/UTC]","0.0","0.56"
"Vanilla Playwright Test","New Todo should clear text input field when an item is added","SUCCESS","2022-12-20T23:24:40.641Z[Etc/UTC]","0.0","0.5"
"Vanilla Playwright Test","New Todo should reflect the number of items left in the counter","SUCCESS","2022-12-20T23:24:41.142Z[Etc/UTC]","0.0","0.64"
"Vanilla Playwright Test","New Todo should show #main and #footer when items added","SUCCESS","2022-12-20T23:24:41.786Z[Etc/UTC]","0.0","0.52"
"Recording items","Todo List App should clear text input field when an item is added","SUCCESS","2022-12-20T23:24:48.481Z[Etc/UTC]","0.0","0.96"
"Vanilla Playwright Test","New Todo should allow me to add todo items","SUCCESS","2022-12-20T23:24:51.772Z[Etc/UTC]","0.0","0.97"
"Vanilla Playwright Test","New Todo should show #main and #footer when items added","SUCCESS","2022-12-20T23:24:54.815Z[Etc/UTC]","0.0","0.88"
